[
  {
    "year": 2026,
    "week": 32,
    "slug": "2026-32",
    "headline": "Skärmfritt, assistans och sänkt dieselskatt dominerar veckans löften",
    "body_md": "Denna veckas löften handlar mycket om skola, assistans och skatter — med Liberalerna som den mest produktiva parten och Sverigedemokraterna bakom de tyngsta enskilda kronposterna.\n\n**Skola och skärmar**\nLiberalerna vill införa skärmfritt låg- och mellanstadium [p-2026-0559] samt skärmfria fritidshem och fritidsklubbar [p-2026-0563]. Partiet vill också fördubbla läsningen i skolan till 2030 [p-2026-0560] och införa en skolboksgaranti för egen lärobok i varje ämne, till en kostnad av 500 miljoner kronor per år [p-2026-0576]. Vidare vill L införa nolltolerans mot hot, kränkningar och ordningsstörningar [p-2026-0553] och dra in studiebidraget för gymnasieelever som hotar eller kränker, vilket uppskattas kosta 5 miljoner kronor per år [p-2026-0566]. L vill även återinföra läxhjälps-RUT till 50 miljoner kronor årligen [p-2026-0574] och dubbla stödet till hågkomstresor till 16 miljoner kronor per år [p-2026-0571]. Miljöpartiet vill stoppa vinstuttag i den svenska skolan [p-2026-0561].\n\n**Assistans**\nLiberalerna och Sverigedemokraterna gemensamma assistanssatsningar är veckans tyngsta område. Höjd assistansersättning med 7 procent beräknas kosta 2 300 miljoner kronor per år [p-2026-0565]. Indexering av assistansersättningen beräknas till 600 miljoner kronor årligen [p-2026-0570], förstatligande av personlig assistans till 10 miljoner kronor per år [p-2026-0569] och fler fysiska möten för assistansbedömningar till 20 miljoner kronor per år [p-2026-0568].\n\n**Skatter och energi**\nSverigedemokraterna vill sänka dieselskatten, vilket är veckans dyraste enskilda löfte med 4 200 miljoner kronor per år [p-2026-0573]. SD vill också ge full statlig ersättning vid brukanderestriktioner till 400 miljoner kronor årligen [p-2026-0572].\n\n**Övrigt**\nLiberalerna vill stärka skyddet för synagogor och judiska skolor genom skyddsobjektsstatus [p-2026-0555], införa 15-årsgräns för sociala medier [p-2026-0562] och höja VAB-ersättningen till 90 procent under de fem första dagarna till 600 miljoner kronor per år [p-2026-0579]. L vill också att tjänstepension ska ingå i bodelning vid skilsmässa [p-2026-0564]. SD vill inrätta en effektiviseringsminister till 10 miljoner kronor per år [p-2026-0567], satsa på lokala viltslakterier och skyttebanor till 200 miljoner kronor årligen [p-2026-0575] och höja ersättningen till eftersöksjägare till 15 miljoner kronor per år [p-2026-0578]. Moderaterna vill bekämpa mäns våld mot kvinnor med samma kraft som gängkriminalitet [p-2026-0580].\n\n**Veckans total**\nKostnadstäckta löften denna vecka uppgår till cirka 35,7 miljarder kronor för mandatperioden. Totalt finansieringsgap: fläsket uppgår till 2 578 miljarder kronor, regeringens reformbudget till 320 miljarder kronor för mandatperioden, vilket ger ett finansieringsgap på cirka 2 258 miljarder kronor.",
    "promise_ids": [
      "p-2026-0553",
      "p-2026-0554",
      "p-2026-0555",
      "p-2026-0556",
      "p-2026-0557",
      "p-2026-0558",
      "p-2026-0559",
      "p-2026-0560",
      "p-2026-0561",
      "p-2026-0562",
      "p-2026-0563",
      "p-2026-0564",
      "p-2026-0565",
      "p-2026-0566",
      "p-2026-0567",
      "p-2026-0568",
      "p-2026-0569",
      "p-2026-0570",
      "p-2026-0571",
      "p-2026-0572",
      "p-2026-0573",
      "p-2026-0574",
      "p-2026-0575",
      "p-2026-0576",
      "p-2026-0577",
      "p-2026-0578",
      "p-2026-0579",
      "p-2026-0580"
    ],
    "total_msek": 2578488,
    "gap_msek": 2258488,
    "generated_at": "2026-08-04T06:01:58.400Z",
    "run_id": "run-2026-08-04-06-01",
    "archived": true
  },
  {
    "year": 2026,
    "week": 31,
    "slug": "2026-31",
    "headline": "Omstart: 2 509 miljarder lovade, 320 miljarder att ta av",
    "body_md": "Den här krönikan startar om serien.\n\nDe fyra tidigare krönikorna byggde på summor som sedan dess visat sig vara\nkraftigt felräknade — de talade om 8,8 till 13 miljoner miljoner kronor när\nrikssumman i dag är 2,5. Skillnaden är inte att politiken ändrats, utan att\nbeloppen räknats om från grunden, ämne för ämne, under juli 2026.\n\nKrönikor är ögonblicksbilder och skrivs aldrig om. Därför är de fyra gamla\narkiverade i stället för rättade: de finns kvar i sin helhet i projektets data\npå GitHub och går att läsa där, men de visas inte längre här. Att låta dem\nligga kvar synliga hade varit att publicera siffror vi vet är fel.\n\nSå här ser läget ut i dag. Åtta partier har 417 löften i registret. Det de\nlovar kostar tillsammans 2 509 miljarder kronor för mandatperioden 2027–2030.\nRegeringens reformutrymme för samma period är 320 miljarder. Gapet mellan vad\nsom lovas och vad som finns är alltså 2 189 miljarder kronor.\n\nTvå tredjedelar av pengarna ligger i tre ämnen: skatterna, försvaret och\nvälfärden. Hälften av hela summan ryms i elva löften.\n\nVarje belopp har en öppen uträkning på sin löftessida. Håller du inte med om\nen siffra går det att se exakt vilket antagande den vilar på.",
    "promise_ids": [
      "p-2026-0141",
      "p-2026-0100"
    ],
    "total_msek": 2508836,
    "gap_msek": 2188836,
    "generated_at": "2026-07-28T15:00:00.000Z",
    "run_id": "manuell-uppstartskronika-2026-07-28",
    "archived": true
  },
  {
    "year": 2026,
    "week": 30,
    "slug": "2026-30",
    "headline": "Slopat fribelopp och lättare att jobba vid sidan av studierna – veckans fläsk",
    "body_md": "Två löften om studenter har tillkommit eller ändrats den här veckan, och båda handlar om gränsdragningen mellan studiemedel och inkomst från arbete.\n\nModeraterna vill slopa fribeloppet för studenter under sommaren [p-2026-0546]. I dag finns ett fribelopp som gör att studenter kan tjäna en viss summa utan att studiemedelet sänks; M vill alltså ta bort det just för sommarperioden. Kostnaden uppskattas till 150 miljoner kronor per år, eller 600 miljoner kronor under en mandatperiod [p-2026-0546].\n\nLiberalerna går i delvis samma riktning men med bredare sikte: de vill underlätta för studenter att jobba och samtidigt behålla studiemedlen [p-2026-0547]. Det är inte specificerat exakt hur detta ska gå till, men prislappen är dubbelt så hög som Moderaternas – 300 miljoner kronor årligen och 1 200 miljoner kronor under mandatperioden [p-2026-0547].\n\nBåda löften är klassade som LLM-estimat, vilket betyder att beloppen är framräknade med hjälp av språkmodell och inte direkt hämtade från partiernas egna kalkyler [p-2026-0546][p-2026-0547].\n\n**Veckans totalsumma:** 1 800 miljoner kronor under mandatperioden (600 + 1 200) [p-2026-0546][p-2026-0547].\n\n**Aktuellt finansieringsgap:** Fläsket totalt 8 755 miljarder kronor; regeringens reformbudget 320 miljarder kronor för mandatperioden; finansieringsgap ≈ 8 435 miljarder kronor.",
    "promise_ids": [
      "p-2026-0546",
      "p-2026-0547"
    ],
    "total_msek": 8755415,
    "gap_msek": 8435415,
    "generated_at": "2026-07-23T11:17:53.073Z",
    "run_id": "run-2026-07-23-11-17",
    "archived": true
  },
  {
    "year": 2026,
    "week": 29,
    "slug": "2026-29",
    "headline": "Avskaffa elskatten helt och plånbokslöften delar förstaplatsen — 25 miljarder om året styck",
    "body_md": "Veckan har bjudit på ett bjudfat som får statsfinanserna att likna en all-you-can-eat-buffé.\n\nS lägger fram sitt plånbokslöfte — höjt barn- och studiebidrag, billigare mediciner, avgiftsfri tandvård och skydd mot höga elpriser — till 25 000 miljoner kronor årligen [p-2026-0481]. Dessutom vill S ta bort den orättvisa karensen [p-2026-0488], förbjuda vinstuttag ur skolan [p-2026-0475] och införa generellt förbud mot värdeöverföringar från skola och förskola [p-2026-0476].\n\nSD vill avskaffa elskatten helt, också det för 25 000 miljoner om året [p-2026-0486]. Till det lägger man permanent nedsatt moms på mat [p-2026-0485], allmän och skattefinansierad arbetslöshetskassa [p-2026-0483] och högkostnadsskydd i tandvården för alla medborgare [p-2026-0484] — sammanlagt 35 000 miljoner årligen utöver elskatten.\n\nMP och V vill båda ge kraftigt stärkta resurser till vård, socialtjänst, psykiatri och skola, vardera 15 000 miljoner per år [p-2026-0473, p-2026-0474]. V vill dessutom återinföra gratis tandvård för unga upp till 23 år [p-2026-0494] och införa ett högkostnadsskydd för tandvården med ett maxtak på 1 450 kr per år [p-2026-0489].\n\nC vill reformera skolpengen för att premiera ansvar och kvalitet [p-2026-0500] och inför gemensamt skolval och avskaffa kösystem [p-2026-0499]. L vill ge personlig husläkare för den som blir sjuk [p-2026-0487] och sänka skatten för den som utbildar sig [p-2026-0537].\n\nMP vill genomföra en genomgripande reform av SiS med mindre och barnrättssäkra enheter [p-2026-0520] och tillföra Kriminalvården nödvändiga resurser [p-2026-0522], båda till 2 000 miljoner årligen. SD vill göra medlemskap i kriminella gäng olagligt [p-2026-0534] och klassa förnedringsrån och gruppvåldtäkter som hatbrott [p-2026-0514].\n\nVeckans totala fläsk uppgår till 8 782 miljarder kronor. Regeringens reformbudget uppgår till 320 miljarder kronor för mandatperioden. Finansieringsgapet landar på cirka 8 462 miljarder kronor.",
    "promise_ids": [
      "p-2026-0473",
      "p-2026-0474",
      "p-2026-0475",
      "p-2026-0476",
      "p-2026-0477",
      "p-2026-0478",
      "p-2026-0479",
      "p-2026-0480",
      "p-2026-0481",
      "p-2026-0482",
      "p-2026-0483",
      "p-2026-0484",
      "p-2026-0485",
      "p-2026-0486",
      "p-2026-0487",
      "p-2026-0488",
      "p-2026-0489",
      "p-2026-0490",
      "p-2026-0491",
      "p-2026-0492",
      "p-2026-0493",
      "p-2026-0494",
      "p-2026-0495",
      "p-2026-0496",
      "p-2026-0497",
      "p-2026-0498",
      "p-2026-0499",
      "p-2026-0500",
      "p-2026-0501",
      "p-2026-0502",
      "p-2026-0503",
      "p-2026-0504",
      "p-2026-0505",